{
  "schema_version": 1,
  "service_id": "svc-ops-core",
  "host_id": "lab-global-ops",
  "expected_state": "unresolved-conflict",
  "actual_state": "unresolved-conflict",
  "observed_at": "2026-09-10T00:00:00Z",
  "error": {"code": "context_conflict", "message": "ledger and facts disagree", "details": {"reason": "unresolved-conflict"}}
}
